Show,Date,Person,Media Type,Media Value,,Title,,,,,,,,,,,,,,,,,,,,,200,10/15/08,David Eisenbach|Chuck Colson,1,r_OqvFJhDRY,,How God Turned Around Nixon's Hatchet Man,,,,,,,,,,,,,,,,,,,,,200,10/9/08,Stephen Davis,4,http://www.veritas.org/talks/uniqueness-christianity/?view=all-talks&ccm_paging_p=40,,The Uniqueness of Christianity,,,,,,,,,,,,,,,,,,,,,200,4/23/08,N. T. Wright,4,http://www.veritas.org/talks/why-does-jesus-resurrection-matter/?view=all-talks&ccm_paging_p=40,,Why Does Jesus' Resurrection Matter?,,,,,,,,,,,,,,,,,,,,,200,4/18/08,Scott Yenor,4,http://www.veritas.org/talks/suffering-and-modernity-scraping-barnacles/?view=all-talks&ccm_paging_p=40,,Suffering and Modernity: Scraping Barnacles,,,,,,,,,,,,,,,,,,,,,200,4/18/08,Scott Yenor,4,http://www.veritas.org/talks/suffering-and-modernity-making-suffering-sensible/?view=all-talks&ccm_paging_p=40,,Suffering and Modernity: Making Suffering Sensible,,,,,,,,,,,,,,,,,,,,,200,4/10/08,William Lane Craig|Louise Antony,1,6wKkbquUDSM?rel=0,,Is God Necessary for Morality?,,,,,,,,,,,,,,,,,,,,,200,3/20/08,Jennifer Wiseman,4,http://www.veritas.org/talks/marvelous-universe/?view=all-talks&ccm_paging_p=40,,A Marvelous Universe,,,,,,,,,,,,,,,,,,,,,200,3/19/08,Bethany Hoang,4,http://www.veritas.org/talks/there-hope-hopeless-world-perspectives-serving-others-and-seeking-justice/?view=all-talks&ccm_paging_p=40,,Is there hope in a hopeless world? Perspectives on serving others and seeking justice,,,,,,,,,,,,,,,,,,,,,200,3/6/08,Timothy J. Keller,4,http://www.veritas.org/talks/reason-god-belief-age-skepticism1/?view=all-talks&ccm_paging_p=40,,The Reason for God: Belief in an age of Skepticism,,,,,,,,,,,,,,,,,,,,,200,3/4/08,Timothy J. Keller,4,http://www.veritas.org/talks/one-nation-under-god-faith-love-public-sphere/?view=all-talks&ccm_paging_p=41,,One Nation Under God: Faith & Love in the Public Sphere,,,,,,,,,,,,,,,,,,,,,200,3/4/08,Timothy J. Keller,4,http://www.veritas.org/talks/clip-explain-away-religion-tim-keller-argues-we-cant/?view=all-talks&ccm_paging_p=41,,[Clip] Explain away religion? Tim Keller argues that we can't.,,,,,,,,,,,,,,,,,,,,,200,3/4/08,Alister McGrath,4,http://www.veritas.org/talks/gospel-public-truth/?view=all-talks&ccm_paging_p=41,,Gospel As Public Truth,,,,,,,,,,,,,,,,,,,,,200,3/4/08,Lisa Harper,4,http://www.veritas.org/talks/politics-jesus/?view=all-talks&ccm_paging_p=41,,Politics of Jesus,,,,,,,,,,,,,,,,,,,,,200,3/4/08,Timothy J. Keller,4,http://www.veritas.org/talks/conversation-tim-keller-belief-age-skepticism/?view=all-talks&ccm_paging_p=41,,A Conversation with Tim Keller: Belief in an Age of Skepticism?,,,,,,,,,,,,,,,,,,,,,200,3/1/08,Rev. John Polkinghorne,4,http://www.veritas.org/talks/science-public-sphere/?view=all-talks&ccm_paging_p=41,,Science in the Public Sphere,,,,,,,,,,,,,,,,,,,,,200,2/29/08,Mary Poplin,4,http://www.veritas.org/talks/justice-christian-and-secular/?view=all-talks&ccm_paging_p=41,,Justice: Christian and Secular,,,,,,,,,,,,,,,,,,,,,200,2/29/08,Baroness Caroline Cox,4,http://www.veritas.org/talks/religious-freedom/?view=all-talks&ccm_paging_p=41,,Religious Freedom,,,,,,,,,,,,,,,,,,,,,200,2/27/08,Timothy J. Keller,4,http://www.veritas.org/talks/reason-god-belief-age-skepticism2/?view=all-talks&ccm_paging_p=41,,Reason for God? Belief in an Age of Skepticism,,,,,,,,,,,,,,,,,,,,,200,2/26/08,Timothy J. Keller,4,http://www.veritas.org/talks/how-could-good-god-allow-suffering-belief-age-skepticism/?view=all-talks&ccm_paging_p=41,,How Could a Good God Allow Suffering? Belief in an Age of Skepticism,,,,,,,,,,,,,,,,,,,,,200,2/21/08,William Lane Craig,1,QdDfw3fTqIk?rel=0,,Can We Be Good Without God?,,,,,,,,,,,,,,,,,,,,,200,2/20/08,Robert M. Bowman Jr.,4,http://www.veritas.org/talks/are-there-objective-truths/?view=all-talks&ccm_paging_p=41,,Are There Objective Truths?,,,,,,,,,,,,,,,,,,,,,200,2/20/08,Walter Bradley,4,http://www.veritas.org/talks/bio-friendly-universe-design/?view=all-talks&ccm_paging_p=41,,The Bio-Friendly Universe: By Design?,,,,,,,,,,,,,,,,,,,,,200,2/19/08,Fritz Schaefer|H. Fritz Schaefer III|Henry Schaefer,4,http://www.veritas.org/talks/scientists-and-their-gods/?view=all-talks&ccm_paging_p=41,,Scientists and Their Gods,,,,,,,,,,,,,,,,,,,,,200,2/19/08,Stuart McAllister,4,http://www.veritas.org/talks/faith-reasonable/?view=all-talks&ccm_paging_p=41,,Is Faith Reasonable?,,,,,,,,,,,,,,,,,,,,,200,2/19/08,Timothy J. Keller|Martin Bashir|David Eisenbach,4,http://www.veritas.org/talks/reason-god-belief-age-skepticism3/?view=all-talks&ccm_paging_p=41,,Reason for God? Belief in an Age of Skepticism,,,,,,,,,,,,,,,,,,,,,200,2/18/08,Dawn Eden,4,http://www.veritas.org/talks/thrill-chaste/?view=all-talks&ccm_paging_p=42,,The Thrill of the Chaste,,,,,,,,,,,,,,,,,,,,,200,2/18/08,Dallas Willard,4,http://www.veritas.org/talks/what-your-u-wont-teach-u-u-r-apt-catch-anyway/?view=all-talks&ccm_paging_p=42,,"What Your U Won't Teach U, But U r Apt to Catch Anyway",,,,,,,,,,,,,,,,,,,,,200,2/17/08,Dallas Willard,4,http://www.veritas.org/talks/value-truth/?view=all-talks&ccm_paging_p=42,,The Value of Truth,,,,,,,,,,,,,,,,,,,,,200,2/13/08,Hugh Ross,4,http://www.veritas.org/talks/creation-evolution-or-both/?view=all-talks&ccm_paging_p=42,,"Creation, Evolution or Both?",,,,,,,,,,,,,,,,,,,,,200,2/11/08,Fazale Rana,4,http://www.veritas.org/talks/creation-evolution-or-both1/?view=all-talks&ccm_paging_p=42,,"Creation, Evolution or Both?",,,,,,,,,,,,,,,,,,,,,200,1/26/08,Alister McGrath|Professor Lionel Tarassenko|Professor Andrew Briggs,4,http://www.veritas.org/talks/science-are-we-machines/?view=all-talks&ccm_paging_p=42,,Science: Are We Machines?,,,,,,,,,,,,,,,,,,,,,200,1/26/08,Edmund Newell,4,http://www.veritas.org/talks/blessed-are-poor-young-development-practitioners-forum/?view=all-talks&ccm_paging_p=42,,Blessed are the Poor: A Young Development Practitioners' Forum,,,,,,,,,,,,,,,,,,,,,200,1/25/08,Rev Cyprian Yobera|Andrew Dilnot|Sabina Alkire,4,http://www.veritas.org/talks/blessed-are-poor/?view=all-talks&ccm_paging_p=42,,Blessed are the Poor,,,,,,,,,,,,,,,,,,,,,200,1/18/08,David Westlake,4,http://www.veritas.org/talks/richpoor-dinner/?view=all-talks&ccm_paging_p=42,,Rich/Poor Dinner,,,,,,,,,,,,,,,,,,,,,200,11/29/07,Rev Cyprian Yobera,4,http://www.veritas.org/talks/colonialism-and-missionary-legacy-africa/?view=all-talks&ccm_paging_p=42,,Colonialism and the Missionary Legacy in Africa,,,,,,,,,,,,,,,,,,,,,200,11/16/07,Roger Lundin,4,http://www.veritas.org/talks/modern-literature-and-question-belief/?view=all-talks&ccm_paging_p=42,,Modern Literature and the Question of Belief,,,,,,,,,,,,,,,,,,,,,200,11/16/07,Jay Richards,4,http://www.veritas.org/talks/christian-perspective-environment/?view=all-talks&ccm_paging_p=42,,A Christian Perspective on the Environment,,,,,,,,,,,,,,,,,,,,,200,11/15/07,Guillermo Gonzalez,4,http://www.veritas.org/talks/our-privileged-planet/?view=all-talks&ccm_paging_p=42,,Our Privileged Planet,,,,,,,,,,,,,,,,,,,,,200,11/14/07,Jon Rittenhouse,4,http://www.veritas.org/talks/postmodernism/?view=all-talks&ccm_paging_p=42,,Postmodernism,,,,,,,,,,,,,,,,,,,,,200,11/8/07,Greg Ganssle,4,http://www.veritas.org/talks/faith-reason-and-knowledge-god/?view=all-talks&ccm_paging_p=42,,"Faith, Reason, and the Knowledge of God",,,,,,,,,,,,,,,,,,,,,200,10/26/07,Amy Orr-Ewing,4,http://www.veritas.org/talks/bible-intolerant/?view=all-talks&ccm_paging_p=42,,Is the Bible Intolerant?,,,,,,,,,,,,,,,,,,,,,200,10/26/07,Os Guinness,4,http://www.veritas.org/talks/time-truth-living-free-world-lies-hype-and-spin/?view=all-talks&ccm_paging_p=43,,"Time for Truth: Living Free in a World of Lies, Hype and Spin",,,,,,,,,,,,,,,,,,,,,200,10/25/07,Vishal Mangalwadi,4,http://www.veritas.org/talks/truth-and-social-reform/?view=all-talks&ccm_paging_p=43,,Truth and Social Reform,,,,,,,,,,,,,,,,,,,,,200,10/24/07,Mary Poplin,4,http://www.veritas.org/talks/seeking-truth-radical-conversion-professor/?view=all-talks&ccm_paging_p=43,,Seeking Truth: The Radical Conversion of a Professor,,,,,,,,,,,,,,,,,,,,,200,10/20/07,Guillermo Gonzalez|Jay Richards,4,http://www.veritas.org/talks/fine-tuning-universe/?view=all-talks&ccm_paging_p=43,,The Fine-Tuning of the Universe,,,,,,,,,,,,,,,,,,,,,200,10/17/07,W. Brad Wilcox,4,http://www.veritas.org/talks/wedded-bliss-what-makes-happy-marriages/?view=all-talks&ccm_paging_p=43,,Wedded Bliss: What Makes for Happy Marriages,,,,,,,,,,,,,,,,,,,,,200,4/12/07,Kelly Monroe Kullberg,4,http://www.veritas.org/talks/interpersonal-forgiveness-whats-so-good-about-loving-your-enemy/?view=all-talks&ccm_paging_p=43,,Interpersonal Forgiveness: What's So Good About Loving Your Enemy?,,,,,,,,,,,,,,,,,,,,,200,4/11/07,Fritz Schaefer,4,http://www.veritas.org/talks/big-bang-stephen-hawking-and-god1/?view=all-talks&ccm_paging_p=43,,"The Big Bang, Stephen Hawking, and God",,,,,,,,,,,,,,,,,,,,,200,4/11/07,William Lane Craig,4,http://www.veritas.org/talks/wednesday-keynote-and-q/?view=all-talks&ccm_paging_p=43,,Wednesday Keynote and Q&A,,,,,,,,,,,,,,,,,,,,,200,4/10/07,H. Fritz Schaefer III,4,http://www.veritas.org/talks/big-bang-stephen-hawking-and-god6/?view=all-talks&ccm_paging_p=43,,"The Big Bang, Stephen Hawking, and God",,,,,,,,,,,,,,,,,,,,,200,4/10/07,William Lane Craig,4,http://www.veritas.org/talks/tuesday-keynote/?view=all-talks&ccm_paging_p=43,,Tuesday Keynote,,,,,,,,,,,,,,,,,,,,,200,4/10/07,H. Fritz Schaefer III,4,http://www.veritas.org/talks/big-bang-stephen-hawking-and-god5/?view=all-talks&ccm_paging_p=43,,"The Big Bang, Stephen Hawking, and God",,,,,,,,,,,,,,,,,,,,,200,3/28/07,Mary Poplin,4,http://www.veritas.org/talks/making-mind-set-against-god-intellectual-principles-i-was-and-wasnt-taught-college/?view=all-talks&ccm_paging_p=43,,The Making of a Mind Set Against God: The Intellectual Principles I Was and Wasn't Taught in College,,,,,,,,,,,,,,,,,,,,,200,3/27/07,Beverly Chen,4,http://www.veritas.org/talks/created-connect-purpose-relationships/?view=all-talks&ccm_paging_p=43,,Created to Connect: The Purpose of Relationships,,,,,,,,,,,,,,,,,,,,,200,3/26/07,Jimmy McGee,4,http://www.veritas.org/talks/journey-towards-wholeness-while-making-difference-world/?view=all-talks&ccm_paging_p=43,,The Journey Towards Wholeness while Making a Difference in the World,,,,,,,,,,,,,,,,,,,,,200,3/3/07,Rosalind Picard|Rodney Brooks,4,http://www.veritas.org/talks/living-machines-can-robots-become-human/?view=all-talks&ccm_paging_p=43,,Living Machines: Can Robots Become Human?,,,,,,,,,,,,,,,,,,,,,200,3/2/07,Ian Hutchinson|Ned Hall,4,http://www.veritas.org/talks/belligerents-or-brothers/?view=all-talks&ccm_paging_p=44,,Belligerents or Brothers?,,,,,,,,,,,,,,,,,,,,,200,2/28/07,Steve McDaniel,4,http://www.veritas.org/talks/how-do-we-know-bible-true-evidence-dead-sea-scrolls-and-other-archeological-findings/?view=all-talks&ccm_paging_p=44,,How Do We Know the Bible Is True?: Evidence from the Dead Sea Scrolls and Other Archeological Findings,,,,,,,,,,,,,,,,,,,,,200,2/28/07,Greg Jesson,4,http://www.veritas.org/talks/why-good-god-allows-suffering/?view=all-talks&ccm_paging_p=44,,Why A Good God Allows Suffering,,,,,,,,,,,,,,,,,,,,,200,2/27/07,Garrett DeWeese|Richard Gale Ph.D.|Tim Geddert Ph.D.|Terry Winant Ph.D.,4,http://www.veritas.org/talks/what-does-it-mean-be-human1/?view=all-talks&ccm_paging_p=44,,What Does It Mean to Be Human?,,,,,,,,,,,,,,,,,,,,,200,2/27/07,Hugh Ross|Fazale Rana|Bob Brick|Paul Lindahl|Thomas McKnight,4,http://www.veritas.org/talks/evolution-or-intelligent-design/?view=all-talks&ccm_paging_p=44,,Evolution or Intelligent Design?,,,,,,,,,,,,,,,,,,,,,200,2/26/07,Hugh Ross|Fazale Rana,4,http://www.veritas.org/talks/hope-purpose-and-destiny-what-science-tells-us-about-future-humanity/?view=all-talks&ccm_paging_p=44,,"Hope, Purpose, and Destiny: What Science Tells Us About the Future of Humanity",,,,,,,,,,,,,,,,,,,,,200,2/24/07,Mark Campisano|Karen Hung Kees|Andrea Reid,4,http://www.veritas.org/talks/lifepostharvardedu/?view=all-talks&ccm_paging_p=44,,life@post.harvard.edu,,,,,,,,,,,,,,,,,,,,,200,2/22/07,Francis J. Beckwith,4,http://www.veritas.org/talks/why-be-tolerant/?view=all-talks&ccm_paging_p=44,,Why Be Tolerant?,,,,,,,,,,,,,,,,,,,,,200,2/22/07,Michael Caldwell,4,http://www.veritas.org/talks/human-musical-expression/?view=all-talks&ccm_paging_p=44,,Human Musical Expression,,,,,,,,,,,,,,,,,,,,,200,2/21/07,Bruce S. Thornton Ph.D.,4,http://www.veritas.org/talks/have-humans-progressed/?view=all-talks&ccm_paging_p=44,,Have Humans Progressed?,,,,,,,,,,,,,,,,,,,,,200,2/21/07,Francis J. Beckwith,4,http://www.veritas.org/talks/can-we-be-good-without-god1/?view=all-talks&ccm_paging_p=44,,Can We Be Good Without God?,,,,,,,,,,,,,,,,,,,,,200,2/21/07,Owen Gingerich,4,http://www.veritas.org/talks/pornography-whats-big-deal/?view=all-talks&ccm_paging_p=44,,Pornography: What's the Big Deal?,,,,,,,,,,,,,,,,,,,,,200,2/21/07,Denis Alexander|Janna Levin,4,http://www.veritas.org/talks/dawkins-and-divine/?view=all-talks&ccm_paging_p=44,,Dawkins and the Divine,,,,,,,,,,,,,,,,,,,,,200,2/20/07,Larry Martin,4,http://www.veritas.org/talks/social-justice-human-slaveryhuman-freedom/?view=all-talks&ccm_paging_p=44,,Social Justice: Human Slavery/Human Freedom,,,,,,,,,,,,,,,,,,,,,200,12/31/06,Alister McGrath|David Helfand,4,DagGhOvR8Js?rel=0,,"The God Delusion? Richard Dawkins, Daniel Dennett, and the Meaning of Life",,,,,,,,,,,,,,,,,,,,,200,12/31/06,Alister McGrath|David Helfand,4,DagGhOvR8Js?rel=0,,"The God Delusion? Richard Dawkins, Daniel Dennett, and the Meaning of Life",,,,,,,,,,,,,,,,,,,,,200,12/31/06,Vinoth Ramachandra|Jeffrey Sachs|Larry Reed,4,http://www.veritas.org/talks/who-will-solve-problem-poverty-bono-bill-gates-you/?view=all-talks&ccm_paging_p=45,,"Who Will Solve the Problem of Poverty? Bono, Bill Gates, You?",,,,,,,,,,,,,,,,,,,,,200,12/1/06,Dallas Willard,4,http://www.veritas.org/talks/nature-and-necessity-worldviews/?view=all-talks&ccm_paging_p=45,,The Nature and Necessity of Worldviews,,,,,,,,,,,,,,,,,,,,,200,11/15/06,Alvin Plantinga,4,PwE_D9GUC0s,,An Evolutionary Argument Against Naturalism,,,,,,,,,,,,,,,,,,,,,200,11/15/06,Craig Blomberg,4,http://www.veritas.org/talks/debugging-da-vinci-code/?view=all-talks&ccm_paging_p=45,,"Debugging ""The Da Vinci Code""",,,,,,,,,,,,,,,,,,,,,200,10/24/06,D.A. Carson,4,http://www.veritas.org/talks/home-amid-wounds-was-jesus-dying-god-or-death-death/?view=all-talks&ccm_paging_p=45,,Home Amid the Wounds: Was Jesus a Dying God or the Death of Death?,,,,,,,,,,,,,,,,,,,,,200,10/20/06,N. T. Wright,4,http://www.veritas.org/talks/simply-christian/?view=all-talks&ccm_paging_p=45,,Simply Christian,,,,,,,,,,,,,,,,,,,,,200,9/14/06,Erwin McManus|T.K. Nakagaki,4,http://www.veritas.org/talks/there-purpose-life-buddhist-and-christian-perspecitve/?view=all-talks&ccm_paging_p=45,,Is There Purpose to Life? A Buddhist and a Christian Perspecitve,,,,,,,,,,,,,,,,,,,,,200,4/9/06,Ron Sider,4,http://www.veritas.org/talks/new-vision-overcoming-poverty-america/?view=all-talks&ccm_paging_p=45,,A New Vision of Overcoming Poverty in America,,,,,,,,,,,,,,,,,,,,,200,4/9/06,Todd Madigan,4,http://www.veritas.org/talks/paradox-poverty/?view=all-talks&ccm_paging_p=45,,The Paradox of Poverty,,,,,,,,,,,,,,,,,,,,,200,4/9/06,Bethany Hoang,4,http://www.veritas.org/talks/why-good-people-do-nothing/?view=all-talks&ccm_paging_p=45,,Why Good People Do Nothing,,,,,,,,,,,,,,,,,,,,,200,3/15/06,J. Budziszewski,4,http://www.veritas.org/talks/playing-dumb-natural-consequences-violating-natural-law/?view=all-talks&ccm_paging_p=45,,Playing Dumb: The Natural Consequences of Violating the Natural Law,,,,,,,,,,,,,,,,,,,,,200,3/15/06,J. Budziszewski,4,http://www.veritas.org/talks/natural-law-moral-truth-and-conscience/?view=all-talks&ccm_paging_p=45,,"Natural Law, Moral Truth, and Conscience",,,,,,,,,,,,,,,,,,,,,200,3/15/06,J. Budziszewski,4,http://www.veritas.org/talks/toleration-and-moral-truth/?view=all-talks&ccm_paging_p=45,,Toleration and Moral Truth,,,,,,,,,,,,,,,,,,,,,200,3/14/06,Mary Poplin,4,http://www.veritas.org/talks/mother-teresa-difference-between-social-work-and-religious-work/?view=all-talks&ccm_paging_p=45,,Mother Teresa: The Difference Between Social Work and Religious Work,,,,,,,,,,,,,,,,,,,,,200,3/13/06,Os Guinness,4,http://www.veritas.org/talks/one-unanswerable-objection-christian-faith-christians/?view=all-talks&ccm_paging_p=45,,The One Unanswerable Objection to the Christian Faith: Christians,,,,,,,,,,,,,,,,,,,,,200,3/13/06,Os Guinness,4,http://www.veritas.org/talks/one-true-god-monotheism-glory-or-scandal-west/?view=all-talks&ccm_paging_p=46,,One True God: Monotheism The Glory or the Scandal of the West?,,,,,,,,,,,,,,,,,,,,,200,3/12/06,Os Guinness,4,http://www.veritas.org/talks/journey-thinking-persons-quest-meaning2/?view=all-talks&ccm_paging_p=46,,The Journey: A Thinking Person's Quest for Meaning,,,,,,,,,,,,,,,,,,,,,200,2/23/06,Panel|Timothy J. Keller|David Koepsell,4,http://www.veritas.org/talks/now-what-confronting-our-power/?view=all-talks&ccm_paging_p=46,,Now What? Confronting Our Power,,,,,,,,,,,,,,,,,,,,,200,2/23/06,Gabe Allen,4,http://www.veritas.org/talks/wallbuilders/?view=all-talks&ccm_paging_p=46,,Wallbuilders,,,,,,,,,,,,,,,,,,,,,200,2/22/06,Steve Evans,4,http://www.veritas.org/talks/are-there-moral-absolutes1/?view=all-talks&ccm_paging_p=46,,Are There Moral Absolutes?,,,,,,,,,,,,,,,,,,,,,200,2/22/06,Steve Evans,4,http://www.veritas.org/talks/are-there-moral-absolutes2/?view=all-talks&ccm_paging_p=46,,Are There Moral Absolutes?,,,,,,,,,,,,,,,,,,,,,200,2/21/06,Hugh Ross,4,http://www.veritas.org/talks/there-scientific-evidence-existence-god/?view=all-talks&ccm_paging_p=46,,Is There Scientific Evidence for the Existence of God?,,,,,,,,,,,,,,,,,,,,,200,12/31/05,William Lane Craig,4,http://www.veritas.org/talks/resurrection-fact-or-fiction/?view=all-talks&ccm_paging_p=46,,The Resurrection: Fact or Fiction?,,,,,,,,,,,,,,,,,,,,,200,11/11/05,Drew Trotter,4,http://www.veritas.org/talks/what-did-cs-lewis-mean-and-does-it-matter-preview-lion-witch-and-wardrobe/?view=all-talks&ccm_paging_p=46,,"What Did C.S. Lewis Mean, and Does It Matter? A Preview of ""The Lion, the Witch and the Wardrobe""",,,,,,,,,,,,,,,,,,,,,200,11/10/05,Frederica Mathewes-Green,4,http://www.veritas.org/talks/what-real-meaning-sex/?view=all-talks&ccm_paging_p=46,,What is the Real Meaning of Sex?,,,,,,,,,,,,,,,,,,,,,200,11/10/05,Drew Trotter,4,http://www.veritas.org/talks/meaning-and-movies-what-5-academy-award-nominees-best-picture-tell-us-about-ourselves/?view=all-talks&ccm_paging_p=46,,Meaning and the Movies: What the 5 Academy Award Nominees for Best Picture Tell Us About Ourselves,,,,,,,,,,,,,,,,,,,,,200,11/9/05,William Edgar,4,http://www.veritas.org/talks/meaning-and-significance-personal-journey/?view=all-talks&ccm_paging_p=46,,Meaning and Significance: A Personal Journey,,,,,,,,,,,,,,,,,,,,,200,4/30/05,Ben Witherington,4,http://www.veritas.org/talks/breaking-davinci-code-question-jesus-and-historical-truth/?view=all-talks&ccm_paging_p=46,,Breaking the DaVinci Code: The Question of Jesus and Historical Truth,,,,,,,,,,,,,,,,,,,,,200,4/30/05,Mary Poplin,4,http://www.veritas.org/talks/making-sense-radical-conversion-professor/?view=all-talks&ccm_paging_p=46,,Making Sense: The Radical Conversion of a Professor,,,,,,,,,,,,,,,,,,,,,200,4/29/05,Hugh Ross|Fazale Rana|George Murphy|Marc Pinsonneault|Dana Wrensch,4,http://www.veritas.org/talks/question-god-evolution-and-origin-life-chance-or-design-scientific-model-testing-intelligent-design/?view=all-talks&ccm_paging_p=46,,The Question of God: 'Evolution and the Origin of life: Chance or Design?' A scientific model for testing Intelligent Design,,,,,,,,,,,,,,,,,,,,,200,3/22/05,Nicholas Wolterstorff,4,http://www.veritas.org/talks/are-there-christian-foundations-political-liberty/?view=all-talks&ccm_paging_p=47,,Are There Christian Foundations for Political Liberty?,,,,,,,,,,,,,,,,,,,,,200,3/21/05,Dick Keyes,4,http://www.veritas.org/talks/where-freedom-pluralistic-society/?view=all-talks&ccm_paging_p=47,,Where is Freedom in a Pluralistic Society?,,,,,,,,,,,,,,,,,,,,,200,3/16/05,Greg Jesson,4,http://www.veritas.org/talks/life-will-break-your-heart/?view=all-talks&ccm_paging_p=47,,Life Will Break your Heart,,,,,,,,,,,,,,,,,,,,,200,3/15/05,Walter Bradley,4,http://www.veritas.org/talks/there-scientific-evidence-intelligent-creator-universe/?view=all-talks&ccm_paging_p=47,,Is there Scientific Evidence for an Intelligent Creator of the Universe?,,,,,,,,,,,,,,,,,,,,,200,2/23/05,Richard John Neuhaus,4,http://www.veritas.org/talks/who-we-are-theological-perspective/?view=all-talks&ccm_paging_p=47,,Who We Are: A Theological Perspective,,,,,,,,,,,,,,,,,,,,,200,2/21/05,Dan Blazer,4,http://www.veritas.org/talks/who-we-are-filmmakers-perspective/?view=all-talks&ccm_paging_p=47,,Who We Are: A Filmmaker's Perspective,,,,,,,,,,,,,,,,,,,,,200,2/17/05,Antonye Holyde,4,http://www.veritas.org/talks/truth-art/?view=all-talks&ccm_paging_p=47,,Truth in Art,,,,,,,,,,,,,,,,,,,,,200,2/17/05,Brian Bolton,4,http://www.veritas.org/talks/does-god-exist1/?view=all-talks&ccm_paging_p=47,,Does God Exist?,,,,,,,,,,,,,,,,,,,,,200,2/16/05,Os Guinness,4,http://www.veritas.org/talks/time-truth-living-free-world-lies-hype-and-spin1/?view=all-talks&ccm_paging_p=47,,"Time for Truth: Living Free in a World of Lies, Hype, and Spin",,,,,,,,,,,,,,,,,,,,,200,2/16/05,David Miller,4,http://www.veritas.org/talks/faith-and-work-oil-and-water/?view=all-talks&ccm_paging_p=47,,Faith and Work: Like Oil and Water?,,,,,,,,,,,,,,,,,,,,,200,2/15/05,Lilian Barger,4,http://www.veritas.org/talks/body-bound-women-and-spirituality/?view=all-talks&ccm_paging_p=47,,Body Bound: Women and Spirituality,,,,,,,,,,,,,,,,,,,,,200,2/15/05,Michael Behe,4,http://www.veritas.org/talks/intelligent-design-necessary-full-explanation-molecular-structure-life/?view=all-talks&ccm_paging_p=47,,Is Intelligent Design Necessary for a Full Explanation for the Molecular Structure of Life?,,,,,,,,,,,,,,,,,,,,,200,2/15/05,James Westgate|Imam Ali Al-Ghazvini|Mark Young|Devin Carroll|Lise Rosenthal,4,http://www.veritas.org/talks/what-do-you-believe-and-why/?view=all-talks&ccm_paging_p=47,,What Do You Believe And Why?,,,,,,,,,,,,,,,,,,,,,200,2/14/05,Eleonore Stump,4,http://www.veritas.org/talks/job-and-problem-evil/?view=all-talks&ccm_paging_p=47,,Job and the Problem of Evil,,,,,,,,,,,,,,,,,,,,,200,2/11/05,Don Miller,4,http://www.veritas.org/talks/rethinking-relationships/?view=all-talks&ccm_paging_p=48,,Rethinking Relationships,,,,,,,,,,,,,,,,,,,,,200,2/10/05,David Porteous,4,http://www.veritas.org/talks/poverty-and-creative-response-micro-finance-and-economic-development/?view=all-talks&ccm_paging_p=48,,Poverty and the Creative Response: Micro-Finance and Economic Development,,,,,,,,,,,,,,,,,,,,,200,2/7/05,Robert Thurman|Philip Kitcher|Finny Kuruvilla,4,http://www.veritas.org/talks/buddha-man-and-jesus/?view=all-talks&ccm_paging_p=48,,"Buddha, Man, and Jesus",,,,,,,,,,,,,,,,,,,,,200,1/29/05,Os Guinness,4,http://www.veritas.org/talks/unspeakable-facing-evil-age-genocide-and-terrorism1/?view=all-talks&ccm_paging_p=48,,Unspeakable: Facing Evil in an Age of Genocide and Terrorism,,,,,,,,,,,,,,,,,,,,,200,1/29/05,Os Guinness,4,http://www.veritas.org/talks/unspeakable-facing-evil-age-genocide-and-terrorism/?view=all-talks&ccm_paging_p=48,,Unspeakable: Facing Evil in an Age of Genocide and Terrorism,,,,,,,,,,,,,,,,,,,,,200,1/29/05,Gary Habermas,4,http://www.veritas.org/talks/veracity-new-testament/?view=all-talks&ccm_paging_p=48,,Veracity of the New Testament,,,,,,,,,,,,,,,,,,,,,200,1/15/05,Ben Patterson,4,http://www.veritas.org/talks/does-anybody-really-know-what-time-it/?view=all-talks&ccm_paging_p=48,,Does Anybody Really Know What Time It Is?,,,,,,,,,,,,,,,,,,,,,200,1/15/05,Steve Mayer,4,http://www.veritas.org/talks/policies-and-porches-embracing-breadth-justice/?view=all-talks&ccm_paging_p=48,,Policies and Porches: Embracing the Breadth of Justice,,,,,,,,,,,,,,,,,,,,,200,1/15/05,Ken Heffner,4,http://www.veritas.org/talks/holy-worldliness-christian-approach-popular-culture/?view=all-talks&ccm_paging_p=48,,Holy Worldliness: A Christian Approach to Popular Culture,,,,,,,,,,,,,,,,,,,,,200,1/15/05,Scott Bolinder|Sabrina Fairchild|Scott Millen|Josh Schicker,4,http://www.veritas.org/talks/producers-discerning-media-world-inside-out/?view=all-talks&ccm_paging_p=48,,The Producers: Discerning the Media World from the Inside Out,,,,,,,,,,,,,,,,,,,,,200,1/15/05,Tim Fry|Jane Graham|Lori Strehler|Molly Halvey|Fred Johnson|Jena Lee,4,http://www.veritas.org/talks/africa-engaging-aids-poverty-and-human-rights-issues/?view=all-talks&ccm_paging_p=48,,"Africa: Engaging AIDS, Poverty, and Human Rights Issues",,,,,,,,,,,,,,,,,,,,,200,1/14/05,Mary Poplin,4,http://www.veritas.org/talks/my-future-meaning-life-and-jesus/?view=all-talks&ccm_paging_p=48,,"My Future, The Meaning of Life, and Jesus",,,,,,,,,,,,,,,,,,,,,200,1/12/05,Ward Gasque,4,http://www.veritas.org/talks/da-vinci-code-fact-or-fiction/?view=all-talks&ccm_paging_p=48,,The da Vinci Code: Fact or Fiction?,,,,,,,,,,,,,,,,,,,,,200,1/12/05,John Perkins,4,http://www.veritas.org/talks/john-perkins-racial-justice/?view=all-talks&ccm_paging_p=48,,John Perkins on Racial Justice,,,,,,,,,,,,,,,,,,,,,200,1/11/05,Bruce Kuhn,4,http://www.veritas.org/talks/acts-apostles/?view=all-talks&ccm_paging_p=48,,The Acts of the Apostles,,,,,,,,,,,,,,,,,,,,,200,11/10/04,Armand Nicholi,4,http://www.veritas.org/talks/question-god-sigmund-freud-and-cs-lewis/?view=all-talks&ccm_paging_p=48,,The Question of God: Sigmund Freud and CS Lewis,,,,,,,,,,,,,,,,,,,,,200,10/24/04,Michael Strauss,4,http://www.veritas.org/talks/origin-and-design-universe/?view=all-talks&ccm_paging_p=49,,On the Origin and Design of the Universe,,,,,,,,,,,,,,,,,,,,,