Show Code,Date,People,Media Type,Media Code,Media URL,Media Title,Media Description220,9/23/14,Christine Flood,1,QcwyKLlmXeY,,"""Shenandoah: An open source pauseless GC for OpenJDK."" by Christine Flood","Back in the lisp machine days hitting a GC pause meant it was time to go get a cup of coffee. Java Virtual Machines (JVMs) do better by using parallel (multiple threads working together) and concurrent (gc threads working while the mutator is running) techniques however pauses still cost time and in the case of online transactions money. This talk will discuss a new GC algorithm being developed at Red Hat for OpenJDK. Shenandoah is the first open-source OpenJDK GC algorithm that does marking and evacuation concurrently with running Java threads. This allows us to keep our pause times under 10ms even for heaps of 100+GBs. by Christine Flood - Red Hat Christine H. Flood has been designing and implementing programming languages for over 20 years. Starting with Lisp machines, dabbling with implicitly parallel languages like ID and Fortress and diving into the bits of Java Virtual Machine implementations. She's written multiple papers on GC algorithms and is delighted to be taking them to the next level for OpenJDK."220,9/22/14,Martin Thompson,1,tM4YskS94b0,,"""Aeron: Open-source high-performance messaging"" by Martin Thompson","Does TCP not meet your required latency consistently? Is UDP not reliable enough? Do you need to multicast? What about flow control, congestion control, and a means to avoid head of line blocking that can be integrated with the application? Or perhaps youÕre just fascinated by how to design for the cutting edge of performance? Maybe you have tried higher level messaging products and found they are way too complicated because of the feature bloat driven by product marketing cycles. Aeron takes it back-to-basics with a pure focus on performance and reliability. We have built it from the ground up with mechanical sympathy in its DNA. The data structures are lock-free, wait-free, copy-free, and even persistent for our functional friends. Interaction with the media is layered so you can swap between UDP, Inifiniband, or Shared Memory as required. Aeron is open-source with implementations in Java and C++ that interoperate. There are no unnecessary features to bloat the implementation, yet the design is open so that it can be composed into higher level abstractions. This talk will focus on the design of Aeron and what we learned trying to achieve very consistent performance. We will explore the challenges of dealing with reliable message delivery over UDP and the data structures necessary to support transmission and retransmission in in a lock-free and wait-free manner. by Martin Thompson (@mjpt777) Martin is a high-performance and low-latency specialist, with experience gained over two decades working on the bleeding edge of large transactional and big-data systems. He believes in Mechanical Sympathy, i.e. applying an understanding of the hardware to the creation of software as being fundamental to delivering elegant high-performance solutions. The Disruptor framework is just one example of what his mechanical sympathy has created. Martin was the co-founder and CTO of LMAX. He blogs at mechanical-sympathy.blogspot.com, and can be found giving training courses on performance and concurrency when he is not cutting code to make systems better."220,9/22/14,Michael Drogalis,1,vG47Gui3hYE,,"""Onyx: Distributed Workflows for Dynamic Systems"" by Michael Drogalis","If you've ever jumped heads down into a codebase maintaining complex distributed activity and tried to simplify or change the processing workflow, not only will you scratch your head for 7 sleepless nights before you can get anywhere, but you'll come to realize that workflows are often deeply complected with their mechanism of execution. In this talk, we'll survey contemporary frameworks such as Storm and Cascading. We'll identify the pain points that seem to crop up time and time again: workflow specification, stateful lifecycle management,and developer testing - to name a few. Onyx is a new distributed computation system written in Clojure that addresses these problems head-on. Hardware advancements in the last 10 years have enabled new designs that leverage fast networks and SSDs. Onyx takes advantage and adapts to this new environment. The concepts and tools discussed remove the incidental complexity that plagues modern frameworks. Attendees will come away with new perspective on leveraging immutability, persistent data structures, queues, and transactions to tackle increasingly complex problem spaces. by Michael Drogalis (@MichaelDrogalis) Michael Drogalis is a software engineering consultant who mainly focuses on Clojure and Datomic"220,9/22/14,Daira Hopwood,1,oPeo0upCGqo,,"""How to make error handling less error-prone"" by Daira Hopwood","Error handling is one of the most difficult problems in computer science and in practical programming. Incorrect error handling often leads to security vulnerabilities (such as many of the recent spate of bugs found in TLS implementations), data loss, and user frustration. In this talk, we'll first discuss why programs using existing error handling styles and mechanisms (return and status code checking, conditions and restarts, and exceptions) often fail to recover correctly from errors. We argue that this is due to a fundamental conflict between encapsulation and having enough information to recover a consistent state.Then we explain how this conflict can be solved by providing language support for automatically recovering the state before the call that failed, so that failures cannot cause inconsistency. We also describe how the 'Ken' protocol complements this automatic recovery and extends it to asynchronous and distributed systems. by Daira Hopwood (@DairaHopwood) - LeastAuthority.com Daira Hopwood works on cloud storage systems for LeastAuthority.com. Ze has a long-standing interest in programming language research and security, and after 20 years has finally turned that into a concrete language design. Daira is transgender and uses 'ze/hir' pronouns."220,9/22/14,Doug Rohrer,1,a-OCorBXX7M,,"""Elixir and the Internet of Things"" by Doug Rohrer","The Internet of Things is upon us and being able to efficiently interconnect things will become increasingly difficult as more of them become available. How can we handle the stampede of connecting devices efficiently? When Ruby failed to live up to the task, we turned to Elixir and Erlang and were astonished by the results. This session will showcase the use of Elixir for a real-world production system. We will walk though the actual code and discuss some of the struggles we faced while learning (enough) Erlang and Elixir to get things up and running. At the end of the presentation, you will have a basic understanding of Erlang's OTP behaviors, realize the importance of restart strategies, know what an ""Acceptor Pool"" is, and how we built one without knowing it. by Doug Rohrer (@JeetKunDoug) Doug has over 20 years of software development experience in complex business and scientific systems. After almost a decade in consulting, he took several years to work with product companies, including what might have been the first application monitoring system for cloud computing applications that itself ran in the cloud. In late 2012, he took a sharp left turn from the world of .Net to focus on Ruby on Rails and other open-source systems, and has a passion for IoT problems based on his work with Nexia Home intelligence and Elixir/Erlang."220,9/22/14,Paul Betts,1,1XNATGjqM6U,,"""FRP In Practice: Taking a look at Reactive[UI/Cocoa]"" by Paul Betts","In this talk, we'll see how the Desktop team at GitHub has taken some of the principles behind Functional Reactive Programming and applied them extensively to today's UI toolkits. We'll dive into a case study of GitHub for Mac / Windows and their backing FRP libraries, ReactiveCocoa + ReactiveUI; we'll see what worked well, what we struggled with, and how to apply the beauty of FRP to languages and frameworks that are decidedly not designed with FRP in mind. by Paul Betts (@paulcbetts) - GitHub I'm a Windows / .NET Hacker for GitHub who graduated from The Ohio State University. In my spare time, I hack on some open-source software, play guitar and bass, and in general am within _ of really awesome."220,9/22/14,Yodit Stanton,1,PHF2P_ec_7s,,"""The Internet of Things in Practice"" by Yodit Stanton","We are at the dawn of an age of connected things, Internet of Things (IOT), some predict that there will be 25 billion new connected devices over the new few years. In this talk, we will peel away the hype and talk about the practicalities of managing IOT at scale. We will explore the protocols, the message queues and the eternal problem of standards. This talk will be a practical one where we will a demonstrate the ingestion and processing of IOT data using azondi, our opensource IOT message processing engine, built in clojure using Netty and implementing the LMAX reactor model. by Yodit Stanton (@yoditstanton) - opensensors.IO Yodit is a developer and founder of opensensors.IO, with a special interest in machine learning. She spends her time building systems for processing and analysing sensor data, as well as hacking clojure."220,9/22/14,Elise Huard,1,1MNTerD8IuI,,"""Writing a game in Haskell"" by Elise Huard","Haskell is a beautiful functional language, written by smart computer scientists, and having clever and elegant functional constructs. It clearly separates pure and impure parts of the program. Game programming on the other hand is a very hands-on discipline, trying to wring out the most of the machine's performance, and aiming for one thing, in disregard of all else: a pleasant, challenging experience for the player. I aim to bring intersect those worlds and describe the process, and the specifics, of writing a Haskell game. Functional reactive programming, bindings to graphical libraries, etc, will all have a role to play. by Elise Huard (@elise_huard) Elise Huard is a software consultant who's been crafting and bashing together software for about 15 years now. Her skill set comprises talking to people, Haskell, Clojure, R, javascript, ruby, C, scaling, and a good few bits and bobs beside. She's spoken at a fair number of conferences, most of them Ruby, some of them javascript, some of them polyglot. She's based in Berlin, Germany. She enjoys reading sci-fi, traveling, cooking, tinkering, and spending time with her husband and baby daughter."220,9/22/14,Ramsey Nasser|Tims Gardner,1,tJr_TD1BtF0,,"""Clojure in Unity 3D: Functional Video Game Development"" by Ramsey Nasser and Tims Gardner","Unity 3D is the de facto industry-standard platform for making games. It is built on Mono, scripted in C#, and exports to a wide range of systems, including OSX, Windows, Linux, iOS, Android, XBox, PlayStation, and the web. We are providing an open-source library integrating Clojure and Unity. Clojure will dramatically improve game development by bringing Lisp-style REPL-based live coding, optimizing macros, and DSLs to Unity's workflow. Persistent data structures will enable previously impossible computations in games, such as speculative AI algorithms, logic programming, and rewindable game state history. Unity's graphics and interaction stack opens up considerable power to Clojure programmers. Optimized 2D and 3D graphics, physics simulations, and integration with hardware such as the Kinect are examples of what is now available to functional programmers. Unity's extensive community and collection of prepackaged assets will make developing games in Clojure practical for the first time. Our talk will cover the indispensable role of platforms like Unity in professional game development, and the new possibilities afforded by its integration with a functional Lisp like Clojure. We will show a demo of our new workflow, discuss historical precedent for this initiative, and conclude with thoughts on future applications of our approach. by Ramsey Nasser (@ra), Tims Gardner (@timsgardner) Ramsey Nasser is a computer scientist, game designer, and educator based in Brooklyn. He researches programming languages by building tools to make computation more expressive and implementing projects that question the basic assumptions we make about code itself. His games playfully push people out of their comfort zones, and are often written in experimental programming languages of his design. A former Eyebeam fellow and a member of Kitchen Table Coders, when he is not reasoning about abstract unintuitive machines, he builds and maintains vintage motorcycles. Tims Gardner is an illustrator and Clojure programmer. His interests include symbolic computation, formal visualization, and psychedelic comics. He is a member of Kitchen Table Coders and aspires to cavitate the moon someday."220,9/22/14,Erin Swenson-Healey|James Cooper,1,3v03NFcyvzc,,"""Haste: Full-Stack Haskell for Non-PhD Candidates"" by Erin Swenson-Healey and James Cooper",220,9/22/14,David Greenberg,1,gVGZHzRjvo0,,"""Mesos: The Operating System for your Cluster"" by David Greenberg",220,9/22/14,Julia Evans,1,0IQlpFWTFbM,,"""You can be a kernel hacker!"" by Julia Evans","Writing operating systems sounds like it's only for wizards, but it turns out that operating systems are written by humans like you and me. I'm going to tell you what a kernel is and why you should care. Then we'll talk about a few concrete ways to get started with kernel hacking, ranging from the super-easy to the terrifyingly difficult. by Julia Evans (@b0rk) - Stripe Julia Evans loves taking apart systems to find how they work, making Serious Computer Programs do silly things, and organizing outreach events to make our developer communities a better place. She works on Stripe's data team."220,9/22/14,Felienne Hermans,1,0CKru5d4GPk,,"""Spreadsheets for developers"" by Felienne Hermans","Spreadsheets are often dismissed by developers for not being ""proper programming"" but that is not true. Since I have shown that spreadsheets are Turing complete (http://boingboing.net/2013/09/20/implementing-a-turing-machine.html) you have no excuse to diss them any longer. In this session, I will implement various algorithms in Excel to show you its power and elegance. After all, spreadsheets are 'live' and functional, so they have everything going for them. Furthermore they are very fit for TDD and rapid prototyping. Reasons for attending this talk: - Just as leaning a second natural language is healthy for your brain (http://www.huffingtonpost.com/dan-roitman/your-mind-on-language-howb3902184.html) so is leaning multiple programming languages. Thinking about familiar problems like sorting or shortest path in a strange environment like spreadsheet formulas is like a workout for your brain. - Next time you are in need of a quick calculation or prototype, do not have to waste time configuring a server and deploying your code. Surely not for everything, but for some problems, spreadsheets are really suited and this talk will teach you about how to handle those. - Being emerged in the world that many of your colleagues and clients live and breath will make it easier to understand them. ________ Don't fight spreadsheets any longer, but learn to love them. by Felienne Hermans (@felienne) _Felienne is a professor and an entrepreneur in the field of spreadsheets. Her PhD thesis which she defended in early 2013, centers on transferring techniques from software engineering, like testing and refactoring, to the world of spreadsheets. In 2010 Felienne founded Infotron, a start up that uses the algorithms she developed during her PhD project to help companies like KLM and ING bank to improve the quality of their spreadsheets. In her spare time, Felienne volunteers as a referee for the First Lego League, a world wide technology competition for kids."220,9/22/14,Mark Hibberd,1,JjYAnBhF2JU,,"""Towards ""annex"", a Fact Based Dependency System"" by Mark Hibberd",220,9/22/14,Aditya Siram,1,lMcRBdSdO_U,,"""Shen: A Sufficiently Advanced Lisp"" by Aditya Siram","Shen is an hosted Lisp that comes with a full-featured macro system, a Prolog, an optional type system more powerful than Haskell's, and does it all in under 5000 lines of code. It has been ported to many platforms including Java, JavaScript and Ruby. In the true Lisp spirit it gives complete freedom to the programmer. And this talk will introduce the language by demoing a complete web-application written in Shen that transitions effortlessly between functional, logic, and imperative styles, seamlessly intermixing macros, statically verified and dynamic code. by Aditya Siram (@deech) I am currently a web developer at Intoximeters, Inc. in St. Louis, Missouri. I do Ruby and JavaScript by day and Haskell and C by candlelight."220,9/22/14,Cliff Moon,1,X1rWgshr3PY,,"""Ludicrous Speed: Designing For Performance on the JVM"" by Cliff Moon","Over the past 3 years the JVM has largely overtaken C++ as the platform of choice for writing high performance software. The JVM / Java can be found powering HFT systems, low latency distributed databases, and real-time analytics platforms in almost every enterprise. During this talk you will come to understand the Java memory and concurrency models, how they interact with modern architectures, and the implications for how you ought to design your software. I will share my experiences designing, scaling and tuning a massive scale real-time analytics system, both the failures and the successes. by Cliff Moon (@moonpolysoft) - Boundary Cliff Moon is the founder and CTO of Boundary. Cliff has lead the building of Boundary's streaming ______________ analytics technology, which processes over 2 trillion metrics per day. Previously, Cliff was a leading engineer at Powerset, which was acquired by Microsoft. While there, Cliff helped kick off the NoSQL movement with his open source Dynomite project."220,9/22/14,Brandon Philips,1,HJIjTTHWYnE,,"""etcd: distributed locking and service discovery"" by Brandon Philips",220,9/22/14,Eric Evans,1,ovMo5pIMj8M,,"""Time Series Data With Apache Cassandra"" by Eric Evans",220,9/22/14,Stefanie Schirmer,1,anj_-Z2L4J0,,"""Dynamic programming at ease - with Grammars, Algebras, Products"" by Stefanie Schirmer",220,9/21/14,Kyle Kingsbury,1,QdkS6ZjeR7Q,,"""Jepsen II: Linearizable Boogaloo"" by Kyle Kingsbury","What is ACID anyway, and why is everyone so uptight about it? When can't we have eventual consistency, and what do we sacrifice in exchange for stronger models? I've spent the last year trying to wrap my head around consistency in distributed systems, and testing databases to see how those consistency models play out in practice. In this talk we'll explore linearizability--one of the strongest consistency models for a concurrent system--move from an academic definition to an intuitive understanding, and see the ways in which databases succeed--and fail--to live up to their consistency claims. by Kyle Kingsbury (@aphyr) - Factual Kyle is the author of Riemann, Timelike, Jepsen, Knossos, and a host of other open-source libraries. He works as a backend engineer at Factual."220,9/21/14,Michael Nygard,1,N5HyVUPuU0E,,"""Simulation Testing"" by Michael Nygard","Testing is not about proving a system is correct. It's a search problem. We look for paths through state space that result in errors. Unit testing explores a tiny subset of possible pathways. Even 100% unit test coverage doesn't guarantee 100% state space coverage. Scripted automated tests are only as rigorous as your most devious testers' imaginations. We can improved our results with controlled randomness. We can simulate inputs to the system under test, using randomness to broaden our search of the state space. At the same time, we control the randomness to ensure our tests are repeatable and that we can verify when bugs are fixed. This talk will introduce the structure of simulation testing as a general technique. We will briefly discuss the Simulant open source framework as an instantiation of these ideas. by Michael Nygard (@mtnygard) - Cognitect Michael Nygard strives to raise the bar and ease the pain for developers around the world. He shares his passion and energy for improvement with everyone he meets, sometimes even with their permission. Living with systems in production taught Michael about the importance of operations and writing production-ready software. Highly-available, highly-scalable commerce systems are his forte. Michael has written and co-authored several books, including ""97 Things Every Software Architect Should Know"" and the best seller ""Release It!"", a book about building software that survives the real world."220,9/21/14,Aaron Bedra,1,cp-Tr0ixCRM,,"""Deterministic Memory Management for Managed Runtimes"" by Aaron Bedra","Following close on the heels of heartbleed we have seen a resurgence in questioning C as the implementation choice for critical infrastructure. With performance innovations on managed runtimes the option to implement more and more critical pieces in alternative languages is becoming tangible. Of course this brings along with it a different set of problems. To re-write a system like OpenSSL or even just to implement SSL/TLS on top of a managed runtime there are some serious obstacles to overcome. This talk will examine solving the memory management problem present when building cyrptographic systems on top of managed runtimes. It's no secret that key material and other such sensitive data should be able to be properly allocated and erased from memory with certainty. Aaron will detail the problem with a small implementation of a common cryptographic system and demonstrate how the issue surfaces. He will then detail what steps need to be taken to solve this issue and re-examine the suitability of using these platforms for critical infrastructure. by Aaron Bedra (@abedra) Aaron is a Senior Fellow at Groupon. He is the creator of Repsheet, an open source threat intelligence and reputation tool for web applications. Aaron is a co-author of Programming Clojure 2nd Edition and a constant contributor to open source software."220,9/21/14,Jonas BonŽr,1,U1C5m8b0qg0,,"""The Road to Akka Cluster, and Beyond"" by Jonas BonŽr",220,9/21/14,Tiark Rompf,1,NTAJNYcsAEE,,"""How types can turn a SQL interpreter into a SQL compiler"" by Tiark Rompf","Commercial and open source database systems consist of millions of lines of highly optimized C code. Yet, their performance on individual queries falls 10x or 100x short of what a hand-written, specialized, implementation of the same query can achieve. In a recent joint project at Oracle Labs and the DATA Lab at EPFL, we have set out to implement a database query engine in Scala. With just about 3000 lines of Scala code, our prototype supports the full TPCH benchmark suite and runs queries several times as fast as highly-tuned commercial systems (> 10x peak speedup). This talk will focus on the key design principle that sets the system apart from other DB engines: where other systems interpret query plans, operator by operator, we generate and compile low-level C code for whole queries using the LMS (Lightweight Modular Staging) framework. _________ In particular, the talk will discuss powerful generative programming patterns such as mixed-stage data structures that contains both static and dynamic parts (e.g. static schema and dynamic values for data records) and staged interpreters which can be mechanically turned into compilers (e.g. for SQL queries or regular expressions). These generative programming techniques provide a high degree of abstraction without performance penalty, and make Scala and LMS a more productive alternative to C for systems-level programming where the last drop of performance matters. by Tiark Rompf (@tiarkrompf) - Oracle Labs Tiark Rompf is a researcher at Oracle Labs. His work focuses on runtime code generation, advanced compiler technology, and associated language support. From 2008 to 2014 he was a member of Martin Odersky's Scala team at EPFL where he developed the LMS compiler framework and made various contributions to the Scala language and toolchain (delimited continuations, efficient immutable data structures, compiler speedups, type system work). He is a regular speaker at conferences."220,9/21/14,David Renshaw,1,A65w-qoyTYg,,"""Cap'n Proto and Rust: Type Systems for Sharing"" by David Renshaw",220,9/21/14,Chris Morgan,1,jVoFws7rp88,,"""Fast, secure, safe: the web that can still be"" by Chris Morgan",220,9/21/14,Ariel Weisberg,1,EmiIUW4splQ,,"""Taming the 9s"" by Ariel Weisberg",220,9/21/14,Aysylu Greenberg,1,XmImGiVuJno,,"""Benchmarking: You're Doing It Wrong"" by Aysylu Greenberg",